Installing CATIA V5,https://www.technia.co.uk/faqs/installing-catia-v5/
Installing CATIA V5 Documentation,https://www.technia.co.uk/faqs/installing-catia-v5-documentation/
Creating a Complete Install Folder from Part Downloads of Dassault Systèmes Products,https://www.technia.co.uk/faqs/creating-a-complete-install-folder/
Issue with CATIA V5-6R2019 (V5R29) GA Installation,https://www.technia.co.uk/faqs/issue-with-catia-v5/
Extracting Offline DSLS License(s),https://www.technia.co.uk/faqs/extracting-offline-dsls-licenses/
Enrolling Concurrent DSLS License(s),https://www.technia.co.uk/faqs/enrolling-concurrent-dsls-licenses/
Dassault Systèmes License Server (DSLS) Installation,https://www.technia.co.uk/faqs/dassault-systemes-license-server-dsls-installation/
Configuring DSLS Client,https://www.technia.co.uk/faqs/configuring-dsls-client/
Updating DSLS Licence Server Utility,https://www.technia.co.uk/faqs/updating-dsls-licence-server-utility/
Enrolling Nodelock DSLS License(s),https://www.technia.co.uk/faqs/enrolling-nodelock-dsls-licenses/
Using DSLS with CATIA V5 R19 & R20,https://www.technia.co.uk/faqs/using-dsls-with-catia-v5-r19-r20/
DSLS Uninstallation,https://www.technia.co.uk/faqs/dsls-uninstallation/
Obtaining a LUM Target ID,https://www.technia.co.uk/faqs/obtaining-a-lum-target-id/
Obtaining a DSLS Computer-ID,https://www.technia.co.uk/faqs/obtaining-a-dsls-pc-id/
Accessing 3DS Support Portal,https://www.technia.co.uk/faqs/3ds-support-portal/
Obtaining a MAC Address,https://www.technia.co.uk/faqs/obtaining-a-mac-address/
Guide to Downloading Media,https://www.technia.co.uk/faqs/guide-to-downloading-media/
Obtaining a FlexNet Host-ID/MAC Address,https://www.technia.co.uk/faqs/obtaining-flexnet-host-id-mac-address-2/
Obtaining a FlexNet ID for VM,https://www.technia.co.uk/faqs/identify-flexnet-ids-for-vm-2/
Obtaining an EXALEAD Host ID,https://www.technia.co.uk/faqs/obtaining-exalead-host-id-2/
Obtaining System Information,https://www.technia.co.uk/faqs/obtaining-system-information/
Obtaining a FlexNet Host-ID/MAC Address,https://www.technia.co.uk/faqs/obtaining-flexnet-host-id-mac-address/
Obtaining an EXALEAD Host ID,https://www.technia.co.uk/faqs/obtaining-exalead-host-id/
Obtaining a FlexNet ID for VM,https://www.technia.co.uk/faqs/identify-flexnet-ids-for-vm/
LUM Installation & Client/Server Configuration,https://www.technia.co.uk/faqs/lum-installation-clientserver-configuration/
Extracting Offline LUM License(s),https://www.technia.co.uk/faqs/extracting-offline-lum-licenses/
Enrolling Nodelock LUM License(s),https://www.technia.co.uk/faqs/enrolling-nodelock-lum-licenses/
Enrolling Concurrent LUM License(s),https://www.technia.co.uk/faqs/enrolling-concurrent-lum-licenses/
Using LUM with CATIA V5 R21 & R22,https://www.technia.co.uk/faqs/lum-alongside-catia-v5-r21-r22/
Obtaining License Usage Logs,https://www.technia.co.uk/faqs/obtaining-license-usage-logs/
What is Software Licensing and How Does It Work?,https://www.technia.co.uk/faqs/what-is-software-licensing-and-how-does-it-work/
SOLIDWORKS Licenses,https://www.technia.co.uk/faqs/solidworks-licenses/
SOLIDWORKS Support & Training,https://www.technia.co.uk/faqs/solidworks-support-training/
